{
  "schemaVersion": "2026-10-01",
  "asOf": "2026-10-06T05:52:00.000Z",
  "service": {
    "hamper": [
      {
        "garmentId": "g_890e5c4604b80434f731",
        "name": "Lightweight oxford — moss",
        "quantity": 1,
        "tracking": "unit"
      },
      {
        "garmentId": "g_51bf43199e364f224fbe",
        "name": "Pima oxford — white",
        "quantity": 1,
        "tracking": "unit"
      }
    ],
    "batches": [
      {
        "batchId": "lb_094cdd6d278b605a6573",
        "channel": "service",
        "status": "partially_returned",
        "collectedAt": "2026-10-01T08:00:00.000Z",
        "returnedAt": null,
        "items": [
          {
            "garmentId": "g_eac59e81f42ceb955644",
            "lotId": "lot_8b551e28227d",
            "quantity": 1,
            "returnedQuantity": 1,
            "status": "returned"
          },
          {
            "garmentId": "g_e7f2b9d2aed13769a619",
            "lotId": "lot_4248dc9e06cd",
            "quantity": 1,
            "returnedQuantity": 0,
            "status": "away"
          },
          {
            "garmentId": "g_6aeda6d82183c005d700",
            "lotId": "lot_7c81f39583f7",
            "quantity": 1,
            "returnedQuantity": 1,
            "status": "returned"
          }
        ],
        "version": 2,
        "names": {
          "g_eac59e81f42ceb955644": "Lightweight oxford — blue",
          "g_e7f2b9d2aed13769a619": "Pima oxford — fatigue",
          "g_6aeda6d82183c005d700": "Lightweight oxford — light blue wide stripe"
        }
      }
    ],
    "nextCollectionAt": "2026-10-09T08:00:00.000Z"
  },
  "handWash": {
    "hamper": [
      {
        "garmentId": "g_74b61322c363333ddd59",
        "name": "Merino — inky blue",
        "quantity": 1,
        "tracking": "anonymous_quantity"
      }
    ]
  },
  "openExceptions": [
    {
      "exceptionId": "lex_0373128b3a68b822",
      "garmentId": "g_e7f2b9d2aed13769a619",
      "name": "Pima oxford — fatigue",
      "kind": "still_away",
      "quantity": 1,
      "batchId": "lb_094cdd6d278b605a6573",
      "occurredAt": "2026-10-03T10:00:00.000Z"
    }
  ]
}
